{
  "items": [
    {
      "id": "2025-06-17-liselotte",
      "title": "Liselotte",
      "date": "06-17-2025",
      "date_iso": "2025-06-17T00:00:00.000Z",
      "author": null,
      "sourceUrl": null,
      "coverImage": null,
      "html": "<!----> <div><p><img src=\"/compendium/2025-06-17-liselotte/f821b55ce22049408142cb274c76b646_002.webp\" class=\"fr-fic\"><br><img src=\"/compendium/2025-06-17-liselotte/d8ef596b0aae4ed9a52ee5803b2bc287.webp\" class=\"fr-fic\"><br>.</p></div>",
      "images": [
        "/compendium/2025-06-17-liselotte/f821b55ce22049408142cb274c76b646_002.webp",
        "/compendium/2025-06-17-liselotte/d8ef596b0aae4ed9a52ee5803b2bc287.webp"
      ],
      "uid": "compendium:2025-06-17-liselotte"
    },
    {
      "id": "2025-05-20-demiurge-luna",
      "title": "Demiurge Luna",
      "date": "05-20-2025",
      "date_iso": "2025-05-20T00:00:00.000Z",
      "author": null,
      "sourceUrl": null,
      "coverImage": null,
      "html": "<!----> <div><p><img src=\"/compendium/2025-05-20-demiurge-luna/cbc440a88ac547f292bc18d1567aafa3_002.webp\" class=\"fr-fic\"><br><img src=\"/compendium/2025-05-20-demiurge-luna/0ac4bb80d4be4510a3666b1d99b7cd6d.webp\" class=\"fr-fic\"><br>.</p></div>",
      "images": [
        "/compendium/2025-05-20-demiurge-luna/cbc440a88ac547f292bc18d1567aafa3_002.webp",
        "/compendium/2025-05-20-demiurge-luna/0ac4bb80d4be4510a3666b1d99b7cd6d.webp"
      ],
      "uid": "compendium:2025-05-20-demiurge-luna"
    },
    {
      "id": "2025-05-07-omega-nadja",
      "title": "Omega Nadja",
      "date": "05-07-2025",
      "date_iso": "2025-05-07T00:00:00.000Z",
      "author": null,
      "sourceUrl": null,
      "coverImage": null,
      "html": "<!----> <div><p><img src=\"/compendium/2025-05-07-omega-nadja/d34e0bf8e5b64bb6848c0d8a0044cdcc_002.webp\" class=\"fr-fic\"><br><img src=\"/compendium/2025-05-07-omega-nadja/74675c7ec74345678cb58c919d7b1fd4.webp\" class=\"fr-fic\"><br>.<br></p></div>",
      "images": [
        "/compendium/2025-05-07-omega-nadja/d34e0bf8e5b64bb6848c0d8a0044cdcc_002.webp",
        "/compendium/2025-05-07-omega-nadja/74675c7ec74345678cb58c919d7b1fd4.webp"
      ],
      "uid": "compendium:2025-05-07-omega-nadja"
    },
    {
      "id": "2025-04-22-luna",
      "title": "Luna",
      "date": "04-22-2025",
      "date_iso": "2025-04-22T00:00:00.000Z",
      "author": null,
      "sourceUrl": null,
      "coverImage": null,
      "html": "<!----> <div><p><img src=\"/compendium/2025-04-22-luna/4294dc70b3164a6e8aae607ee0c42da0_002.webp\" class=\"fr-fic\"><br><img src=\"/compendium/2025-04-22-luna/db50eced49cf4213ac4e477672ad4378.webp\" class=\"fr-fic\"><br>.</p></div>",
      "images": [
        "/compendium/2025-04-22-luna/4294dc70b3164a6e8aae607ee0c42da0_002.webp",
        "/compendium/2025-04-22-luna/db50eced49cf4213ac4e477672ad4378.webp"
      ],
      "uid": "compendium:2025-04-22-luna"
    },
    {
      "id": "2025-03-29-ryu-lion",
      "title": "Ryu Lion",
      "date": "03-29-2025",
      "date_iso": "2025-03-29T00:00:00.000Z",
      "author": null,
      "sourceUrl": null,
      "coverImage": null,
      "html": "<!----> <div><p><img src=\"/compendium/2025-03-29-ryu-lion/2182257501bf42d1a303834671ac1958_002.webp\" class=\"fr-fic\"><br>.</p></div>",
      "images": [
        "/compendium/2025-03-29-ryu-lion/2182257501bf42d1a303834671ac1958_002.webp"
      ],
      "uid": "compendium:2025-03-29-ryu-lion"
    },
    {
      "id": "2025-03-28-ais-wallenstein",
      "title": "Ais Wallenstein",
      "date": "03-28-2025",
      "date_iso": "2025-03-28T00:00:00.000Z",
      "author": null,
      "sourceUrl": null,
      "coverImage": null,
      "html": "<!----> <div><p><img src=\"/compendium/2025-03-28-ais-wallenstein/1e89ca0944a94dbdb88f5e16190e02a7.webp\" class=\"fr-fic\"><br>.</p></div>",
      "images": [
        "/compendium/2025-03-28-ais-wallenstein/1e89ca0944a94dbdb88f5e16190e02a7.webp"
      ],
      "uid": "compendium:2025-03-28-ais-wallenstein"
    },
    {
      "id": "2025-03-27-bell-cranel",
      "title": "Bell Cranel",
      "date": "03-27-2025",
      "date_iso": "2025-03-27T00:00:00.000Z",
      "author": null,
      "sourceUrl": null,
      "coverImage": null,
      "html": "<!----> <div><p><img src=\"/compendium/2025-03-27-bell-cranel/24169adfb85446dea6c596034e3ad9b8.webp\" class=\"fr-fic\"><br>.</p></div>",
      "images": [
        "/compendium/2025-03-27-bell-cranel/24169adfb85446dea6c596034e3ad9b8.webp"
      ],
      "uid": "compendium:2025-03-27-bell-cranel"
    },
    {
      "id": "2025-03-11-skadi",
      "title": "Skadi",
      "date": "03-11-2025",
      "date_iso": "2025-03-11T00:00:00.000Z",
      "author": null,
      "sourceUrl": null,
      "coverImage": null,
      "html": "<!----> <div><p><img src=\"/compendium/2025-03-11-skadi/720f488deb674a54b77e665604e42ea5_002.webp\" class=\"fr-fic\"><br><img src=\"/compendium/2025-03-11-skadi/cb318be2627e423bb265dd251b92900b.webp\" class=\"fr-fic\"><br>.</p></div>",
      "images": [
        "/compendium/2025-03-11-skadi/720f488deb674a54b77e665604e42ea5_002.webp",
        "/compendium/2025-03-11-skadi/cb318be2627e423bb265dd251b92900b.webp"
      ],
      "uid": "compendium:2025-03-11-skadi"
    },
    {
      "id": "2025-02-25-delta",
      "title": "Delta",
      "date": "02-25-2025",
      "date_iso": "2025-02-25T00:00:00.000Z",
      "author": null,
      "sourceUrl": null,
      "coverImage": null,
      "html": "<!----> <div><p><img src=\"/compendium/2025-02-25-delta/99c3623f4c8642acb10756755a6539b5_002.webp\" class=\"fr-fic\"><br><img src=\"/compendium/2025-02-25-delta/8550aa483d7e41babc53032d04738c43.webp\" class=\"fr-fic\"><br>.</p></div>",
      "images": [
        "/compendium/2025-02-25-delta/99c3623f4c8642acb10756755a6539b5_002.webp",
        "/compendium/2025-02-25-delta/8550aa483d7e41babc53032d04738c43.webp"
      ],
      "uid": "compendium:2025-02-25-delta"
    },
    {
      "id": "2025-02-25-demiurge-delta",
      "title": "Demiurge Delta",
      "date": "02-25-2025",
      "date_iso": "2025-02-25T00:00:00.000Z",
      "author": null,
      "sourceUrl": null,
      "coverImage": null,
      "html": "<!----> <div><p><img src=\"/compendium/2025-02-25-demiurge-delta/1e41ec622aeb488cba0b12006c8ba219_002.webp\" class=\"fr-fic\"><br><img src=\"/compendium/2025-02-25-demiurge-delta/c51db3764ac042ec9fc7c6a2d970812c.webp\" class=\"fr-fic\"><br>.</p></div>",
      "images": [
        "/compendium/2025-02-25-demiurge-delta/1e41ec622aeb488cba0b12006c8ba219_002.webp",
        "/compendium/2025-02-25-demiurge-delta/c51db3764ac042ec9fc7c6a2d970812c.webp"
      ],
      "uid": "compendium:2025-02-25-demiurge-delta"
    },
    {
      "id": "2025-02-11-ember-3-7-02-00-edited",
      "title": "Ember (3/7 02:00 Edited)",
      "date": "02-11-2025",
      "date_iso": "2025-02-11T00:00:00.000Z",
      "author": null,
      "sourceUrl": null,
      "coverImage": null,
      "html": "<!----> <div><p>.</p><p><img src=\"/compendium/2025-02-11-ember-3-7-02-00-edited/d519169b58b940839a1ec81ea4cc8717_002.webp\" class=\"fr-fic\"><br><img src=\"/compendium/2025-02-11-ember-3-7-02-00-edited/d94913a76a8746b9b26b71cd91eaf56b.webp\" class=\"fr-fic\"><br></p></div>",
      "images": [
        "/compendium/2025-02-11-ember-3-7-02-00-edited/d519169b58b940839a1ec81ea4cc8717_002.webp",
        "/compendium/2025-02-11-ember-3-7-02-00-edited/d94913a76a8746b9b26b71cd91eaf56b.webp"
      ],
      "uid": "compendium:2025-02-11-ember-3-7-02-00-edited"
    },
    {
      "id": "2024-12-30-gnosis-beth",
      "title": "Gnosis Beth",
      "date": "12-30-2024",
      "date_iso": "2024-12-30T00:00:00.000Z",
      "author": null,
      "sourceUrl": null,
      "coverImage": null,
      "html": "<!----> <div><p><img src=\"/compendium/2024-12-30-gnosis-beth/52f09306d518427bb6a50d9b43b272d5_002.webp\" class=\"fr-fic\"><br><img src=\"/compendium/2024-12-30-gnosis-beth/dd321cec737e4a6daac53560dd721d29.webp\" class=\"fr-fic\"><br>.</p></div>",
      "images": [
        "/compendium/2024-12-30-gnosis-beth/52f09306d518427bb6a50d9b43b272d5_002.webp",
        "/compendium/2024-12-30-gnosis-beth/dd321cec737e4a6daac53560dd721d29.webp"
      ],
      "uid": "compendium:2024-12-30-gnosis-beth"
    },
    {
      "id": "2024-12-17-holy-night-s-blessing-dianne",
      "title": "Holy Night's Blessing Dianne",
      "date": "12-17-2024",
      "date_iso": "2024-12-17T00:00:00.000Z",
      "author": null,
      "sourceUrl": null,
      "coverImage": null,
      "html": "<!----> <div><p><img src=\"/compendium/2024-12-17-holy-night-s-blessing-dianne/ba9c28860a444e249c2a4821173508c5_002.webp\" class=\"fr-fic\"><br><img src=\"/compendium/2024-12-17-holy-night-s-blessing-dianne/abe7eeddb3f24040875a89368dbb38ab.webp\" class=\"fr-fic\"><br>.</p></div>",
      "images": [
        "/compendium/2024-12-17-holy-night-s-blessing-dianne/ba9c28860a444e249c2a4821173508c5_002.webp",
        "/compendium/2024-12-17-holy-night-s-blessing-dianne/abe7eeddb3f24040875a89368dbb38ab.webp"
      ],
      "uid": "compendium:2024-12-17-holy-night-s-blessing-dianne"
    },
    {
      "id": "2024-12-05-caren",
      "title": "Caren",
      "date": "12-05-2024",
      "date_iso": "2024-12-05T00:00:00.000Z",
      "author": null,
      "sourceUrl": null,
      "coverImage": null,
      "html": "<!----> <div><p><img src=\"/compendium/2024-12-05-caren/c551cf7d2f0548069ae750797e38c75f.webp\" class=\"fr-fic\"><br><img src=\"/compendium/2024-12-05-caren/fcb9cce23d484aeead045763a6b991a2.webp\" class=\"fr-fic\"><br>.</p></div>",
      "images": [
        "/compendium/2024-12-05-caren/c551cf7d2f0548069ae750797e38c75f.webp",
        "/compendium/2024-12-05-caren/fcb9cce23d484aeead045763a6b991a2.webp"
      ],
      "uid": "compendium:2024-12-05-caren"
    },
    {
      "id": "2024-11-19-hilde",
      "title": "Hilde",
      "date": "11-19-2024",
      "date_iso": "2024-11-19T00:00:00.000Z",
      "author": null,
      "sourceUrl": null,
      "coverImage": null,
      "html": "<!----> <div><p><img src=\"/compendium/2024-11-19-hilde/132837cc69084d029c600eed7d2fe6ad_002.webp\" class=\"fr-fic\"><br><img src=\"/compendium/2024-11-19-hilde/0d93b0d6e9c546dda5fce18269a014a0.webp\" class=\"fr-fic\"><br>.</p></div>",
      "images": [
        "/compendium/2024-11-19-hilde/132837cc69084d029c600eed7d2fe6ad_002.webp",
        "/compendium/2024-11-19-hilde/0d93b0d6e9c546dda5fce18269a014a0.webp"
      ],
      "uid": "compendium:2024-11-19-hilde"
    },
    {
      "id": "2024-11-05-gnosis-nella",
      "title": "Gnosis Nella",
      "date": "11-05-2024",
      "date_iso": "2024-11-05T00:00:00.000Z",
      "author": null,
      "sourceUrl": null,
      "coverImage": null,
      "html": "<!----> <div><p><img src=\"/compendium/2024-11-05-gnosis-nella/2fce67ed80af48838d461ea48559446d.webp\" class=\"fr-fic\"><br><img src=\"/compendium/2024-11-05-gnosis-nella/27d043c5c1ab4bdfa9a3f4542e323e81.webp\" class=\"fr-fic\"><br>,</p></div>",
      "images": [
        "/compendium/2024-11-05-gnosis-nella/2fce67ed80af48838d461ea48559446d.webp",
        "/compendium/2024-11-05-gnosis-nella/27d043c5c1ab4bdfa9a3f4542e323e81.webp"
      ],
      "uid": "compendium:2024-11-05-gnosis-nella"
    },
    {
      "id": "2024-11-05-rey",
      "title": "Rey",
      "date": "11-05-2024",
      "date_iso": "2024-11-05T00:00:00.000Z",
      "author": null,
      "sourceUrl": null,
      "coverImage": null,
      "html": "<!----> <div><p><img src=\"/compendium/2024-11-05-rey/191b1accb30a4ce0a5d5af35a62fc21f.webp\" class=\"fr-fic\"><br><img src=\"/compendium/2024-11-05-rey/bd6fc922ecd547d3b818649ac5c53c54.webp\" class=\"fr-fic\"><br>.</p></div>",
      "images": [
        "/compendium/2024-11-05-rey/191b1accb30a4ce0a5d5af35a62fc21f.webp",
        "/compendium/2024-11-05-rey/bd6fc922ecd547d3b818649ac5c53c54.webp"
      ],
      "uid": "compendium:2024-11-05-rey"
    },
    {
      "id": "2024-10-22-kitsune-of-eternity-tamamo-no-mae",
      "title": "Kitsune of Eternity Tamamo-no-Mae",
      "date": "10-22-2024",
      "date_iso": "2024-10-22T00:00:00.000Z",
      "author": null,
      "sourceUrl": null,
      "coverImage": null,
      "html": "<!----> <div><p><img src=\"/compendium/2024-10-22-kitsune-of-eternity-tamamo-no-mae/090a446f3e3140c6b7ec0aae5906df6b.webp\" class=\"fr-fic\"><br><img src=\"/compendium/2024-10-22-kitsune-of-eternity-tamamo-no-mae/09c64274a6eb425ca92c6d3fa472bc2d.webp\" class=\"fr-fic\"><br>,</p></div>",
      "images": [
        "/compendium/2024-10-22-kitsune-of-eternity-tamamo-no-mae/090a446f3e3140c6b7ec0aae5906df6b.webp",
        "/compendium/2024-10-22-kitsune-of-eternity-tamamo-no-mae/09c64274a6eb425ca92c6d3fa472bc2d.webp"
      ],
      "uid": "compendium:2024-10-22-kitsune-of-eternity-tamamo-no-mae"
    },
    {
      "id": "2024-09-24-nella",
      "title": "Nella",
      "date": "09-24-2024",
      "date_iso": "2024-09-24T00:00:00.000Z",
      "author": null,
      "sourceUrl": null,
      "coverImage": null,
      "html": "<!----> <div><p><img src=\"/compendium/2024-09-24-nella/eba01bc47b504d878c856704e1b037a8.webp\" class=\"fr-fic\"><br><img src=\"/compendium/2024-09-24-nella/4826f396db424f3caeeb5d82f46f15c2.webp\" class=\"fr-fic\"><br>.</p></div>",
      "images": [
        "/compendium/2024-09-24-nella/eba01bc47b504d878c856704e1b037a8.webp",
        "/compendium/2024-09-24-nella/4826f396db424f3caeeb5d82f46f15c2.webp"
      ],
      "uid": "compendium:2024-09-24-nella"
    },
    {
      "id": "2024-09-10-bryn",
      "title": "Bryn",
      "date": "09-10-2024",
      "date_iso": "2024-09-10T00:00:00.000Z",
      "author": null,
      "sourceUrl": null,
      "coverImage": null,
      "html": "<!----> <div><p><img src=\"/compendium/2024-09-10-bryn/2f583fdf40a8469db791c715b696fc19_002.webp\" class=\"fr-fic\"><br></p><div><img src=\"/compendium/2024-09-10-bryn/5e8d755898404f6c9c60de98bf12e537.webp\" class=\"fr-fic\"></div><div>.</div></div>",
      "images": [
        "/compendium/2024-09-10-bryn/2f583fdf40a8469db791c715b696fc19_002.webp",
        "/compendium/2024-09-10-bryn/5e8d755898404f6c9c60de98bf12e537.webp"
      ],
      "uid": "compendium:2024-09-10-bryn"
    },
    {
      "id": "2024-08-27-roxie",
      "title": "Roxie",
      "date": "08-27-2024",
      "date_iso": "2024-08-27T00:00:00.000Z",
      "author": null,
      "sourceUrl": null,
      "coverImage": null,
      "html": "<!----> <div><p><img src=\"/compendium/2024-08-27-roxie/ca0a4f0a9ebe495fa79c4bb1e86cb412.webp\" class=\"fr-fic\"><br><img src=\"/compendium/2024-08-27-roxie/1d1202556bef4eeb92cc457e67e2e0c3.webp\" class=\"fr-fic\"><br><br><strong><a href=\"/\" class=\"sc-handle\" rel=\"noopener noreferrer\" target=\"_blank\"><strong>#Roxie</strong></a></strong></p></div>",
      "images": [
        "/compendium/2024-08-27-roxie/ca0a4f0a9ebe495fa79c4bb1e86cb412.webp",
        "/compendium/2024-08-27-roxie/1d1202556bef4eeb92cc457e67e2e0c3.webp"
      ],
      "uid": "compendium:2024-08-27-roxie"
    },
    {
      "id": "2024-08-13-maxie",
      "title": "Maxie",
      "date": "08-13-2024",
      "date_iso": "2024-08-13T00:00:00.000Z",
      "author": null,
      "sourceUrl": null,
      "coverImage": null,
      "html": "<!----> <div><p><img src=\"/compendium/2024-08-13-maxie/46ddf9d2231d4b23a192857e1600151c.webp\" class=\"fr-fic\"><br><img src=\"/compendium/2024-08-13-maxie/7c825b362ba04fffaefd91fc54652e02.webp\" class=\"fr-fic\"><br></p><p><strong>#</strong><strong>Maxie</strong></p></div>",
      "images": [
        "/compendium/2024-08-13-maxie/46ddf9d2231d4b23a192857e1600151c.webp",
        "/compendium/2024-08-13-maxie/7c825b362ba04fffaefd91fc54652e02.webp"
      ],
      "uid": "compendium:2024-08-13-maxie"
    },
    {
      "id": "2024-07-30-gnosis-dahlia",
      "title": "Gnosis Dahlia",
      "date": "07-30-2024",
      "date_iso": "2024-07-30T00:00:00.000Z",
      "author": null,
      "sourceUrl": null,
      "coverImage": null,
      "html": "<!----> <div><p><img src=\"/compendium/2024-07-30-gnosis-dahlia/1d6a05b752c34e46950d657bd43951a2.webp\" class=\"fr-fic\"><img src=\"/compendium/2024-07-30-gnosis-dahlia/1cf6220fda074569be3dc7de7514e77f.webp\" class=\"fr-fic\"><br><br>.</p></div>",
      "images": [
        "/compendium/2024-07-30-gnosis-dahlia/1d6a05b752c34e46950d657bd43951a2.webp",
        "/compendium/2024-07-30-gnosis-dahlia/1cf6220fda074569be3dc7de7514e77f.webp"
      ],
      "uid": "compendium:2024-07-30-gnosis-dahlia"
    },
    {
      "id": "2024-07-16-poolside-trickster-regina",
      "title": "Poolside Trickster Regina",
      "date": "07-16-2024",
      "date_iso": "2024-07-16T00:00:00.000Z",
      "author": null,
      "sourceUrl": null,
      "coverImage": null,
      "html": "<!----> <div><p><img src=\"/compendium/2024-07-16-poolside-trickster-regina/00392d68cad54fbbb863ccb8fbc6fdfe_002.webp\" class=\"fr-fic\"><br></p><p><img src=\"/compendium/2024-07-16-poolside-trickster-regina/acfc0de2b1f9491f805f68b72a560389.webp\" class=\"fr-fic\"><br>.</p></div>",
      "images": [
        "/compendium/2024-07-16-poolside-trickster-regina/00392d68cad54fbbb863ccb8fbc6fdfe_002.webp",
        "/compendium/2024-07-16-poolside-trickster-regina/acfc0de2b1f9491f805f68b72a560389.webp"
      ],
      "uid": "compendium:2024-07-16-poolside-trickster-regina"
    },
    {
      "id": "2024-07-02-kappa",
      "title": "Kappa",
      "date": "07-02-2024",
      "date_iso": "2024-07-02T00:00:00.000Z",
      "author": null,
      "sourceUrl": null,
      "coverImage": null,
      "html": "<!----> <div><p><img src=\"/compendium/2024-07-02-kappa/a345176480084a6a9aa5a049bcd98af6_002.webp\" class=\"fr-fic\"><br><img src=\"/compendium/2024-07-02-kappa/db70b9848567444580da1620ffb2bbc2.webp\" class=\"fr-fic\"><br>.</p></div>",
      "images": [
        "/compendium/2024-07-02-kappa/a345176480084a6a9aa5a049bcd98af6_002.webp",
        "/compendium/2024-07-02-kappa/db70b9848567444580da1620ffb2bbc2.webp"
      ],
      "uid": "compendium:2024-07-02-kappa"
    },
    {
      "id": "2024-06-18-fatal",
      "title": "Fatal",
      "date": "06-18-2024",
      "date_iso": "2024-06-18T00:00:00.000Z",
      "author": null,
      "sourceUrl": null,
      "coverImage": null,
      "html": "<!----> <div><p><img src=\"/compendium/2024-06-18-fatal/f8dc9201844a470d852999253b7845e7_002.webp\" class=\"fr-fic\"><br><img src=\"/compendium/2024-06-18-fatal/91b824f69f7c44e88ae0016e09acddb6.webp\" class=\"fr-fic\"><br>.</p></div>",
      "images": [
        "/compendium/2024-06-18-fatal/f8dc9201844a470d852999253b7845e7_002.webp",
        "/compendium/2024-06-18-fatal/91b824f69f7c44e88ae0016e09acddb6.webp"
      ],
      "uid": "compendium:2024-06-18-fatal"
    },
    {
      "id": "2024-06-04-kuro",
      "title": "Kuro",
      "date": "06-04-2024",
      "date_iso": "2024-06-04T00:00:00.000Z",
      "author": null,
      "sourceUrl": null,
      "coverImage": null,
      "html": "<!----> <div><p><img src=\"/compendium/2024-06-04-kuro/43756768962543c89276a1c709d8d08a_002.webp\" class=\"fr-fic\"><img src=\"/compendium/2024-06-04-kuro/4cea9ea566a249b4bf9040724251d3db.webp\" class=\"fr-fic\"></p><br><p>.</p></div>",
      "images": [
        "/compendium/2024-06-04-kuro/43756768962543c89276a1c709d8d08a_002.webp",
        "/compendium/2024-06-04-kuro/4cea9ea566a249b4bf9040724251d3db.webp"
      ],
      "uid": "compendium:2024-06-04-kuro"
    },
    {
      "id": "2024-05-21-monad-eva",
      "title": "Monad Eva",
      "date": "05-21-2024",
      "date_iso": "2024-05-21T00:00:00.000Z",
      "author": null,
      "sourceUrl": null,
      "coverImage": null,
      "html": "<!----> <div><p><img src=\"/compendium/2024-05-21-monad-eva/dcbf5f14ad77422e9f42521f58923803_002.webp\" class=\"fr-fic\"></p><p><img src=\"/compendium/2024-05-21-monad-eva/7428b205aa884e39bb9e328d0ffe3742.webp\" class=\"fr-fic\"><br><br></p>.<br><br></div>",
      "images": [
        "/compendium/2024-05-21-monad-eva/dcbf5f14ad77422e9f42521f58923803_002.webp",
        "/compendium/2024-05-21-monad-eva/7428b205aa884e39bb9e328d0ffe3742.webp"
      ],
      "uid": "compendium:2024-05-21-monad-eva"
    },
    {
      "id": "2024-05-21-tamamo-no-mae",
      "title": "Tamamo-no-Mae",
      "date": "05-21-2024",
      "date_iso": "2024-05-21T00:00:00.000Z",
      "author": null,
      "sourceUrl": null,
      "coverImage": null,
      "html": "<!----> <div><p><img src=\"/compendium/2024-05-21-tamamo-no-mae/d0bcffacb71c46f4955c5b6e6671b709_002.webp\" class=\"fr-fic\"></p><p><img src=\"/compendium/2024-05-21-tamamo-no-mae/3b62737c7d3a435e95a49986437ea4a9.webp\" class=\"fr-fic\"><br><br></p>.<br><br></div>",
      "images": [
        "/compendium/2024-05-21-tamamo-no-mae/d0bcffacb71c46f4955c5b6e6671b709_002.webp",
        "/compendium/2024-05-21-tamamo-no-mae/3b62737c7d3a435e95a49986437ea4a9.webp"
      ],
      "uid": "compendium:2024-05-21-tamamo-no-mae"
    },
    {
      "id": "2024-04-23-dianne",
      "title": "Dianne",
      "date": "04-23-2024",
      "date_iso": "2024-04-23T00:00:00.000Z",
      "author": null,
      "sourceUrl": null,
      "coverImage": null,
      "html": "<!----> <div><p><img src=\"/compendium/2024-04-23-dianne/7c4e285b6c5b41a98c79a993b9629db0_002.webp\" class=\"fr-fic\"><br><img src=\"/compendium/2024-04-23-dianne/e4a7c4f8c1df4cdc86a4a0e34dd95304.webp\" class=\"fr-fic\"></p><p>Dianne</p></div>",
      "images": [
        "/compendium/2024-04-23-dianne/7c4e285b6c5b41a98c79a993b9629db0_002.webp",
        "/compendium/2024-04-23-dianne/e4a7c4f8c1df4cdc86a4a0e34dd95304.webp"
      ],
      "uid": "compendium:2024-04-23-dianne"
    },
    {
      "id": "2024-04-09-edelweiss",
      "title": "Edelweiss",
      "date": "04-09-2024",
      "date_iso": "2024-04-09T00:00:00.000Z",
      "author": null,
      "sourceUrl": null,
      "coverImage": null,
      "html": "<!----> <div><p><img src=\"/compendium/2024-04-09-edelweiss/753dfc7eeeff4a669314b386c32c9794_002.webp\" class=\"fr-fic\"><br><img src=\"/compendium/2024-04-09-edelweiss/ffe02923c9fd4e5ab9831f052fc34ea4.webp\" class=\"fr-fic\"></p><p>Edelweiss</p><br><br></div>",
      "images": [
        "/compendium/2024-04-09-edelweiss/753dfc7eeeff4a669314b386c32c9794_002.webp",
        "/compendium/2024-04-09-edelweiss/ffe02923c9fd4e5ab9831f052fc34ea4.webp"
      ],
      "uid": "compendium:2024-04-09-edelweiss"
    },
    {
      "id": "2024-03-26-kanon",
      "title": "Kanon",
      "date": "03-26-2024",
      "date_iso": "2024-03-26T00:00:00.000Z",
      "author": null,
      "sourceUrl": null,
      "coverImage": null,
      "html": "<!----> <div><p><img src=\"/compendium/2024-03-26-kanon/79489fc9cb39444fa01e1f6c3d64802e_002.webp\" class=\"fr-fic\"><br><img src=\"/compendium/2024-03-26-kanon/5debce79e5c64784ad6233fcd74598a1.webp\" class=\"fr-fic\"><br></p><p>.</p></div>",
      "images": [
        "/compendium/2024-03-26-kanon/79489fc9cb39444fa01e1f6c3d64802e_002.webp",
        "/compendium/2024-03-26-kanon/5debce79e5c64784ad6233fcd74598a1.webp"
      ],
      "uid": "compendium:2024-03-26-kanon"
    },
    {
      "id": "2024-02-27-demiurge-vlada",
      "title": "Demiurge Vlada",
      "date": "02-27-2024",
      "date_iso": "2024-02-27T00:00:00.000Z",
      "author": null,
      "sourceUrl": null,
      "coverImage": null,
      "html": "<!----> <div><p>Beyond humanity, beyond machines.<br>I wield a blade that destroys everything.</p><p><img src=\"/compendium/2024-02-27-demiurge-vlada/d8802b2de4a24cb3a192a1a2aa834a37_002.webp\" class=\"fr-fic\"></p><img src=\"/compendium/2024-02-27-demiurge-vlada/c3fae07e75364b1dbf09ed5305b0d5ef.webp\" class=\"fr-fic\"><br><br></div>",
      "images": [
        "/compendium/2024-02-27-demiurge-vlada/d8802b2de4a24cb3a192a1a2aa834a37_002.webp",
        "/compendium/2024-02-27-demiurge-vlada/c3fae07e75364b1dbf09ed5305b0d5ef.webp"
      ],
      "uid": "compendium:2024-02-27-demiurge-vlada"
    },
    {
      "id": "2024-02-27-vlada",
      "title": "Vlada",
      "date": "02-27-2024",
      "date_iso": "2024-02-27T00:00:00.000Z",
      "author": null,
      "sourceUrl": null,
      "coverImage": null,
      "html": "<!----> <div><p>Stand tall with your head held up high. <br>I’ll be right here, watching over you.</p><p><img src=\"/compendium/2024-02-27-vlada/5459c1d5de634f0ebf531d5a76cc2631_002.webp\" class=\"fr-fic\"></p><p><img src=\"/compendium/2024-02-27-vlada/dc086e6b98d84b8ca447d8cd3996193e.webp\" class=\"fr-fic\"><br><br></p><br><br></div>",
      "images": [
        "/compendium/2024-02-27-vlada/5459c1d5de634f0ebf531d5a76cc2631_002.webp",
        "/compendium/2024-02-27-vlada/dc086e6b98d84b8ca447d8cd3996193e.webp"
      ],
      "uid": "compendium:2024-02-27-vlada"
    },
    {
      "id": "2024-02-13-iota",
      "title": "Iota",
      "date": "02-13-2024",
      "date_iso": "2024-02-13T00:00:00.000Z",
      "author": null,
      "sourceUrl": null,
      "coverImage": null,
      "html": "<!----> <div><p>My name is Iota, king of kings.</p><p><img src=\"/compendium/2024-02-13-iota/6311d27ee79f4bd498fe94d4c36ef8e7_002.webp\" class=\"fr-fic\"><br></p><img src=\"/compendium/2024-02-13-iota/9f796ce044e04556b25fc61fc279f3a3.webp\" class=\"fr-fic\"><br><br></div>",
      "images": [
        "/compendium/2024-02-13-iota/6311d27ee79f4bd498fe94d4c36ef8e7_002.webp",
        "/compendium/2024-02-13-iota/9f796ce044e04556b25fc61fc279f3a3.webp"
      ],
      "uid": "compendium:2024-02-13-iota"
    },
    {
      "id": "2024-01-30-regina",
      "title": "Regina",
      "date": "01-30-2024",
      "date_iso": "2024-01-30T00:00:00.000Z",
      "author": null,
      "sourceUrl": null,
      "coverImage": null,
      "html": "<!----> <div><p>I, the greatest entertainer, welcome you all to my stage!\n<br><img src=\"/compendium/2024-01-30-regina/2c11445018b54cca8b5ba8e617440bfb_002.webp\" class=\"fr-fic\"></p><p><br><img src=\"/compendium/2024-01-30-regina/72ca64c9923542edb6501206ebafe3c2.webp\" class=\"fr-fic\"><br><br></p><br><br></div>",
      "images": [
        "/compendium/2024-01-30-regina/2c11445018b54cca8b5ba8e617440bfb_002.webp",
        "/compendium/2024-01-30-regina/72ca64c9923542edb6501206ebafe3c2.webp"
      ],
      "uid": "compendium:2024-01-30-regina"
    },
    {
      "id": "2024-01-17-charlotte",
      "title": "Charlotte",
      "date": "01-17-2024",
      "date_iso": "2024-01-17T00:00:00.000Z",
      "author": null,
      "sourceUrl": null,
      "coverImage": null,
      "html": "<!----> <div><p>There's nothing that is unexplainable in this world!\n<br><img src=\"/compendium/2024-01-17-charlotte/5ec28c63dc1c442b82b65efbc8a37a2b_002.webp\" class=\"fr-fic\"></p><p><br><img src=\"/compendium/2024-01-17-charlotte/ad1252a03dc6401990b6bea10a39b3c9.webp\" class=\"fr-fic\"><br><br></p><br><br></div>",
      "images": [
        "/compendium/2024-01-17-charlotte/5ec28c63dc1c442b82b65efbc8a37a2b_002.webp",
        "/compendium/2024-01-17-charlotte/ad1252a03dc6401990b6bea10a39b3c9.webp"
      ],
      "uid": "compendium:2024-01-17-charlotte"
    },
    {
      "id": "2024-01-02-mero",
      "title": "Mero",
      "date": "01-02-2024",
      "date_iso": "2024-01-02T00:00:00.000Z",
      "author": null,
      "sourceUrl": null,
      "coverImage": null,
      "html": "<!----> <div><p>So, this is the new set, huh? Nice to meet you!&nbsp;<br><br><img src=\"/compendium/2024-01-02-mero/ce67d342d8b04e228ccaf17dd961144c_002.webp\" class=\"fr-fic\"></p><p><img src=\"/compendium/2024-01-02-mero/db5962d54d98485db53635b62d3cdb04.webp\" class=\"fr-fic\"><br><br></p><br><br></div>",
      "images": [
        "/compendium/2024-01-02-mero/ce67d342d8b04e228ccaf17dd961144c_002.webp",
        "/compendium/2024-01-02-mero/db5962d54d98485db53635b62d3cdb04.webp"
      ],
      "uid": "compendium:2024-01-02-mero"
    },
    {
      "id": "2023-12-19-dahlia",
      "title": "Dahlia",
      "date": "12-19-2023",
      "date_iso": "2023-12-19T00:00:00.000Z",
      "author": null,
      "sourceUrl": null,
      "coverImage": null,
      "html": "<!----> <div><p><img src=\"/compendium/2023-12-19-dahlia/67e463a15756499898699d9c2c10ba2a_002.webp\" class=\"fr-fic\"></p><img src=\"/compendium/2023-12-19-dahlia/47b3bdce129a4275a55219b8e5f445d1.webp\" class=\"fr-fic\"><br><br>I am an Archdemon. I exist to further my own existence.</div>",
      "images": [
        "/compendium/2023-12-19-dahlia/67e463a15756499898699d9c2c10ba2a_002.webp",
        "/compendium/2023-12-19-dahlia/47b3bdce129a4275a55219b8e5f445d1.webp"
      ],
      "uid": "compendium:2023-12-19-dahlia"
    },
    {
      "id": "2023-11-22-epsilon",
      "title": "Epsilon",
      "date": "11-22-2023",
      "date_iso": "2023-11-22T00:00:00.000Z",
      "author": null,
      "sourceUrl": null,
      "coverImage": null,
      "html": "<!----> <div><p><img src=\"/compendium/2023-11-22-epsilon/4b6bfaaa2335471b9cf18b9849844048_002.webp\" class=\"fr-fic\"><br><br>Epsilon, one of the strongest beings in Mirsha who utters nonsensical phrases</p></div>",
      "images": [
        "/compendium/2023-11-22-epsilon/4b6bfaaa2335471b9cf18b9849844048_002.webp"
      ],
      "uid": "compendium:2023-11-22-epsilon"
    },
    {
      "id": "2023-11-21-demiurge-drakhan",
      "title": "Demiurge Drakhan",
      "date": "11-21-2023",
      "date_iso": "2023-11-21T00:00:00.000Z",
      "author": null,
      "sourceUrl": null,
      "coverImage": null,
      "html": "<!----> <div><p><img src=\"/compendium/2023-11-21-demiurge-drakhan/f3bbfe7d91f246dca2e6d15363613ea8_002.webp\" class=\"fr-fic\"><br><br>The ruler of the Dreadnoughts reconstructed by the Dungeon Core</p></div>",
      "images": [
        "/compendium/2023-11-21-demiurge-drakhan/f3bbfe7d91f246dca2e6d15363613ea8_002.webp"
      ],
      "uid": "compendium:2023-11-21-demiurge-drakhan"
    },
    {
      "id": "2023-11-08-drakhan",
      "title": "Drakhan",
      "date": "11-08-2023",
      "date_iso": "2023-11-08T00:00:00.000Z",
      "author": null,
      "sourceUrl": null,
      "coverImage": null,
      "html": "<!----> <div><p><img src=\"/compendium/2023-11-08-drakhan/71e7f411b5354e9190175a01b1d05417_002.webp\" class=\"fr-fic\"><br><br></p><p>The Ruler of The Dreadnought Drakhan</p></div>",
      "images": [
        "/compendium/2023-11-08-drakhan/71e7f411b5354e9190175a01b1d05417_002.webp"
      ],
      "uid": "compendium:2023-11-08-drakhan"
    },
    {
      "id": "2023-10-26-ame",
      "title": "Ame",
      "date": "10-26-2023",
      "date_iso": "2023-10-26T00:00:00.000Z",
      "author": null,
      "sourceUrl": null,
      "coverImage": null,
      "html": "<!----> <div><p><img src=\"/compendium/2023-10-26-ame/a11715d376b24bcaa253d7edad878fe9_002.webp\" class=\"fr-fic\"></p><p>The Passing Rain Ame</p></div>",
      "images": [
        "/compendium/2023-10-26-ame/a11715d376b24bcaa253d7edad878fe9_002.webp"
      ],
      "uid": "compendium:2023-10-26-ame"
    },
    {
      "id": "2023-10-11-akari",
      "title": "Akari",
      "date": "10-11-2023",
      "date_iso": "2023-10-11T00:00:00.000Z",
      "author": null,
      "sourceUrl": null,
      "coverImage": null,
      "html": "<!----> <div><p><img src=\"/compendium/2023-10-11-akari/d0336fa761914f4f96817d0895b51afc_002.webp\" class=\"fr-fic\"></p><p>A bright and social Soulslayer, Akari</p><br><br></div>",
      "images": [
        "/compendium/2023-10-11-akari/d0336fa761914f4f96817d0895b51afc_002.webp"
      ],
      "uid": "compendium:2023-10-11-akari"
    },
    {
      "id": "2023-09-27-christina",
      "title": "Christina",
      "date": "09-27-2023",
      "date_iso": "2023-09-27T00:00:00.000Z",
      "author": null,
      "sourceUrl": null,
      "coverImage": null,
      "html": "<!----> <div><p><img src=\"/compendium/2023-09-27-christina/a49314a9eb974013a36b827b311b7fe7_002.webp\" class=\"fr-fic\"><br><br></p><p>A loyal and youthful public affairs officer of Ful.Mi.NATION, Christina</p></div>",
      "images": [
        "/compendium/2023-09-27-christina/a49314a9eb974013a36b827b311b7fe7_002.webp"
      ],
      "uid": "compendium:2023-09-27-christina"
    },
    {
      "id": "2023-09-13-tamara",
      "title": "Tamara",
      "date": "09-13-2023",
      "date_iso": "2023-09-13T00:00:00.000Z",
      "author": null,
      "sourceUrl": null,
      "coverImage": null,
      "html": "<!----> <div><p><img src=\"/compendium/2023-09-13-tamara/9593aa1d3aba4f8eb0de1677b7b78c91_002.webp\" class=\"fr-fic\"><br></p><p>Numbered Hunter, Tamara</p></div>",
      "images": [
        "/compendium/2023-09-13-tamara/9593aa1d3aba4f8eb0de1677b7b78c91_002.webp"
      ],
      "uid": "compendium:2023-09-13-tamara"
    },
    {
      "id": "2023-09-06-demiurge-astei",
      "title": "Demiurge Astei",
      "date": "09-06-2023",
      "date_iso": "2023-09-06T00:00:00.000Z",
      "author": null,
      "sourceUrl": null,
      "coverImage": null,
      "html": "<!----> <div><p><img src=\"/compendium/2023-09-06-demiurge-astei/b8de22de901c4bb4bfed282783cd1c4f_002.webp\" class=\"fr-fic\"><br><br></p><p><strong>An Archbishop who became divine, Demiurge Astei</strong></p></div>",
      "images": [
        "/compendium/2023-09-06-demiurge-astei/b8de22de901c4bb4bfed282783cd1c4f_002.webp"
      ],
      "uid": "compendium:2023-09-06-demiurge-astei"
    },
    {
      "id": "2023-09-01-astei",
      "title": "Astei",
      "date": "09-01-2023",
      "date_iso": "2023-09-01T00:00:00.000Z",
      "author": null,
      "sourceUrl": null,
      "coverImage": null,
      "html": "<!----> <div><p><img src=\"/compendium/2023-09-01-astei/3ebafc17e98a40faa728fbbdba70ccab.webp\" class=\"fr-fic\"><br><br></p><p><strong>A Benevolent Archbishop, Astei</strong></p></div>",
      "images": [
        "/compendium/2023-09-01-astei/3ebafc17e98a40faa728fbbdba70ccab.webp"
      ],
      "uid": "compendium:2023-09-01-astei"
    },
    {
      "id": "2023-08-25-leo",
      "title": "Leo",
      "date": "08-25-2023",
      "date_iso": "2023-08-25T00:00:00.000Z",
      "author": null,
      "sourceUrl": null,
      "coverImage": null,
      "html": "<!----> <div><p><img src=\"/compendium/2023-08-25-leo/412c4a29676945ce84d5fd456b5ef187_002.webp\" class=\"fr-fic\"><br><br></p><p>The hero of this age</p><p>who extend a helping hand to those in need no matter what race they are</p></div>",
      "images": [
        "/compendium/2023-08-25-leo/412c4a29676945ce84d5fd456b5ef187_002.webp"
      ],
      "uid": "compendium:2023-08-25-leo"
    },
    {
      "id": "2023-08-18-sterope",
      "title": "Sterope",
      "date": "08-18-2023",
      "date_iso": "2023-08-18T00:00:00.000Z",
      "author": null,
      "sourceUrl": null,
      "coverImage": null,
      "html": "<!----> <div><img src=\"/compendium/2023-08-18-sterope/e3595fb68ace44baa37f8f0b7a964d5b_002.webp\" class=\"fr-fic\"><p>Sacreed's Lightning, Sterope&nbsp;</p></div>",
      "images": [
        "/compendium/2023-08-18-sterope/e3595fb68ace44baa37f8f0b7a964d5b_002.webp"
      ],
      "uid": "compendium:2023-08-18-sterope"
    },
    {
      "id": "2023-08-11-hanbyul-lee",
      "title": "Hanbyul Lee",
      "date": "08-11-2023",
      "date_iso": "2023-08-11T00:00:00.000Z",
      "author": null,
      "sourceUrl": null,
      "coverImage": null,
      "html": "<!----> <div><img src=\"/compendium/2023-08-11-hanbyul-lee/2a1437fa276b4783a479bcf2fcdc9660_002.webp\" class=\"fr-fic\"><p>Twinkling Little Angel, Hanbyul Lee</p><p><br><a href=\"/\" class=\"sc-handle\" rel=\"noopener noreferrer\" target=\"_blank\"><strong>#OUTERPLANE</strong></a> <a href=\"/\" class=\"sc-handle\" rel=\"noopener noreferrer\" target=\"_blank\"><strong>#Hanbyul_Lee</strong></a></p></div>",
      "images": [
        "/compendium/2023-08-11-hanbyul-lee/2a1437fa276b4783a479bcf2fcdc9660_002.webp"
      ],
      "uid": "compendium:2023-08-11-hanbyul-lee"
    },
    {
      "id": "2023-08-04-notia",
      "title": "Notia",
      "date": "08-04-2023",
      "date_iso": "2023-08-04T00:00:00.000Z",
      "author": null,
      "sourceUrl": null,
      "coverImage": null,
      "html": "<!----> <div><img src=\"/compendium/2023-08-04-notia/4d7a124bacf24113b9a74ec0c357fb50_002.webp\" class=\"fr-fic\"><p>Notia, the paladin who loyally follows the teachings of god</p></div>",
      "images": [
        "/compendium/2023-08-04-notia/4d7a124bacf24113b9a74ec0c357fb50_002.webp"
      ],
      "uid": "compendium:2023-08-04-notia"
    },
    {
      "id": "2023-07-28-eternal",
      "title": "Eternal",
      "date": "07-28-2023",
      "date_iso": "2023-07-28T00:00:00.000Z",
      "author": null,
      "sourceUrl": null,
      "coverImage": null,
      "html": "<!----> <div><img src=\"/compendium/2023-07-28-eternal/d6331745bcdc497e9b1ad5152a510a16_002.webp\" class=\"fr-fic\"><p>Exotic Necromancer, Eternal</p><p><br><a href=\"/\" class=\"sc-handle\" rel=\"noopener noreferrer\" target=\"_blank\"><strong>#OUTERPLANE</strong></a> <a href=\"/\" class=\"sc-handle\" rel=\"noopener noreferrer\" target=\"_blank\"><strong>#Eternal</strong></a></p></div>",
      "images": [
        "/compendium/2023-07-28-eternal/d6331745bcdc497e9b1ad5152a510a16_002.webp"
      ],
      "uid": "compendium:2023-07-28-eternal"
    },
    {
      "id": "2023-07-21-mene",
      "title": "Mene",
      "date": "07-21-2023",
      "date_iso": "2023-07-21T00:00:00.000Z",
      "author": null,
      "sourceUrl": null,
      "coverImage": null,
      "html": "<!----> <div><img src=\"/compendium/2023-07-21-mene/87a72b44171e45ed8e65b4722fac61a2_002.webp\" class=\"fr-fic\"><p>Little Insomniac Nun, Mene</p><p><br><a href=\"/\" class=\"sc-handle\" rel=\"noopener noreferrer\" target=\"_blank\"><strong>#OUTERPLANE</strong></a> <a href=\"/\" class=\"sc-handle\" rel=\"noopener noreferrer\" target=\"_blank\"><strong>#Mene</strong></a></p></div>",
      "images": [
        "/compendium/2023-07-21-mene/87a72b44171e45ed8e65b4722fac61a2_002.webp"
      ],
      "uid": "compendium:2023-07-21-mene"
    },
    {
      "id": "2023-07-14-aer",
      "title": "Aer",
      "date": "07-14-2023",
      "date_iso": "2023-07-14T00:00:00.000Z",
      "author": null,
      "sourceUrl": null,
      "coverImage": null,
      "html": "<!----> <div><img src=\"/compendium/2023-07-14-aer/36f8ce17d4374dc4bdcd5b1fb8d36f4c_002.webp\" class=\"fr-fic\"><p>Slacking Surfer, Aer</p><p><br><a href=\"/\" class=\"sc-handle\" rel=\"noopener noreferrer\" target=\"_blank\"><strong>#OUTERPLANE</strong></a> <a href=\"/\" class=\"sc-handle\" rel=\"noopener noreferrer\" target=\"_blank\"><strong>#Aer</strong></a></p></div>",
      "images": [
        "/compendium/2023-07-14-aer/36f8ce17d4374dc4bdcd5b1fb8d36f4c_002.webp"
      ],
      "uid": "compendium:2023-07-14-aer"
    },
    {
      "id": "2023-07-10-demiurge-stella",
      "title": "Demiurge Stella",
      "date": "07-10-2023",
      "date_iso": "2023-07-10T00:00:00.000Z",
      "author": null,
      "sourceUrl": null,
      "coverImage": null,
      "html": "<!----> <div><img src=\"/compendium/2023-07-10-demiurge-stella/0ec2963d9f5c42c68492bb5c9c7218ae_002.webp\" class=\"fr-fic\"><p>The arrogant embodiment of the desire for dominance, Demiurge Stella</p><p><br><strong><a href=\"/\" class=\"sc-handle\" rel=\"noopener noreferrer\" target=\"_blank\"><strong>#OUTERPLANE</strong></a> <a href=\"/\" class=\"sc-handle\" rel=\"noopener noreferrer\" target=\"_blank\"><strong>#Demiurge_Stella</strong></a><br></strong></p></div>",
      "images": [
        "/compendium/2023-07-10-demiurge-stella/0ec2963d9f5c42c68492bb5c9c7218ae_002.webp"
      ],
      "uid": "compendium:2023-07-10-demiurge-stella"
    },
    {
      "id": "2023-06-30-saeran",
      "title": "Saeran",
      "date": "06-30-2023",
      "date_iso": "2023-06-30T00:00:00.000Z",
      "author": null,
      "sourceUrl": null,
      "coverImage": null,
      "html": "<!----> <div><img src=\"/compendium/2023-06-30-saeran/a9e4efb9428e438aa4f68a92ccfb2830_002.webp\" class=\"fr-fic\"><p>The saint who creates miracles of healing, Saeran.</p><p><br><strong><a href=\"/\" class=\"sc-handle\" rel=\"noopener noreferrer\" target=\"_blank\"><strong>#OUTERPLANE</strong></a> <a href=\"/\" class=\"sc-handle\" rel=\"noopener noreferrer\" target=\"_blank\"><strong>#Saeran</strong></a></strong></p></div>",
      "images": [
        "/compendium/2023-06-30-saeran/a9e4efb9428e438aa4f68a92ccfb2830_002.webp"
      ],
      "uid": "compendium:2023-06-30-saeran"
    },
    {
      "id": "2023-06-23-beth",
      "title": "Beth",
      "date": "06-23-2023",
      "date_iso": "2023-06-23T00:00:00.000Z",
      "author": null,
      "sourceUrl": null,
      "coverImage": null,
      "html": "<!----> <div><img src=\"/compendium/2023-06-23-beth/34423461e94748a8b9742eef1fb342fd_002.webp\" class=\"fr-fic\"><p>A pure and powerful vampire, Beth</p><p><br><strong><a href=\"/\" class=\"sc-handle\" rel=\"noopener noreferrer\" target=\"_blank\"><strong>#OUTERPLANE</strong></a> <a href=\"/\" class=\"sc-handle\" rel=\"noopener noreferrer\" target=\"_blank\"><strong>#Beth</strong></a></strong></p></div>",
      "images": [
        "/compendium/2023-06-23-beth/34423461e94748a8b9742eef1fb342fd_002.webp"
      ],
      "uid": "compendium:2023-06-23-beth"
    },
    {
      "id": "2023-06-16-francesca",
      "title": "Francesca",
      "date": "06-16-2023",
      "date_iso": "2023-06-16T00:00:00.000Z",
      "author": null,
      "sourceUrl": null,
      "coverImage": null,
      "html": "<!----> <div><img src=\"/compendium/2023-06-16-francesca/f26ab2c0221748b2a9153a100f1dd02a_002.webp\" class=\"fr-fic\"><p>A battle-crazy fiend, Francesca</p><p><br><strong><a href=\"/\" class=\"sc-handle\" rel=\"noopener noreferrer\" target=\"_blank\"><strong>#OUTERPLANE</strong></a> <a href=\"/\" class=\"sc-handle\" rel=\"noopener noreferrer\" target=\"_blank\"><strong>#Francesca</strong></a></strong></p></div>",
      "images": [
        "/compendium/2023-06-16-francesca/f26ab2c0221748b2a9153a100f1dd02a_002.webp"
      ],
      "uid": "compendium:2023-06-16-francesca"
    },
    {
      "id": "2023-06-09-eliza",
      "title": "Eliza",
      "date": "06-09-2023",
      "date_iso": "2023-06-09T00:00:00.000Z",
      "author": null,
      "sourceUrl": null,
      "coverImage": null,
      "html": "<!----> <div><img src=\"/compendium/2023-06-09-eliza/9946c0a237ef444ca8068d4903f81217_002.webp\" class=\"fr-fic\"><p>The Archdemon with absolute power, Eliza</p><p><br><strong><a href=\"/\" class=\"sc-handle\" rel=\"noopener noreferrer\" target=\"_blank\"><strong>#OUTERPLANE</strong></a> <a href=\"/\" class=\"sc-handle\" rel=\"noopener noreferrer\" target=\"_blank\"><strong>#Eliza</strong></a></strong></p></div>",
      "images": [
        "/compendium/2023-06-09-eliza/9946c0a237ef444ca8068d4903f81217_002.webp"
      ],
      "uid": "compendium:2023-06-09-eliza"
    },
    {
      "id": "2023-06-02-noa",
      "title": "Noa",
      "date": "06-02-2023",
      "date_iso": "2023-06-02T00:00:00.000Z",
      "author": null,
      "sourceUrl": null,
      "coverImage": null,
      "html": "<!----> <div><img src=\"/compendium/2023-06-02-noa/864d15a71eab4e68b54652d0a0535e4a_002.webp\" class=\"fr-fic\"><p>A demibeast with a brilliant intellect, Noa<b></b><br><b></b><br><b><a href=\"/\" class=\"sc-handle\" rel=\"noopener noreferrer\" target=\"_blank\"><strong>#OUTERPLANE</strong></a> <a href=\"/\" class=\"sc-handle\" rel=\"noopener noreferrer\" target=\"_blank\"><strong>#Noa</strong></a></b></p></div>",
      "images": [
        "/compendium/2023-06-02-noa/864d15a71eab4e68b54652d0a0535e4a_002.webp"
      ],
      "uid": "compendium:2023-06-02-noa"
    },
    {
      "id": "2023-05-26-laplace",
      "title": "Laplace",
      "date": "05-26-2023",
      "date_iso": "2023-05-26T00:00:00.000Z",
      "author": null,
      "sourceUrl": null,
      "coverImage": null,
      "html": "<!----> <div><img src=\"/compendium/2023-05-26-laplace/5bcc134cacc6453db3d6f0a92478f363_002.webp\" class=\"fr-fic\"><p>The dean of Magnolia who is respected by all mages, Laplace.</p><p><strong><a href=\"/\" class=\"sc-handle\" rel=\"noopener noreferrer\" target=\"_blank\"><strong>#OUTERPLANE</strong></a> <a href=\"/\" class=\"sc-handle\" rel=\"noopener noreferrer\" target=\"_blank\"><strong>#Laplace</strong></a></strong></p></div>",
      "images": [
        "/compendium/2023-05-26-laplace/5bcc134cacc6453db3d6f0a92478f363_002.webp"
      ],
      "uid": "compendium:2023-05-26-laplace"
    },
    {
      "id": "2023-05-19-veronica",
      "title": "Veronica",
      "date": "05-19-2023",
      "date_iso": "2023-05-19T00:00:00.000Z",
      "author": null,
      "sourceUrl": null,
      "coverImage": null,
      "html": "<!----> <div><img src=\"/compendium/2023-05-19-veronica/49d0e668d7f34111bd8440bee7a87eb1_002.webp\" class=\"fr-fic\"><p>The Knight Commander of the Kingdom of the White Falcon, Veronica<br><b></b></p><p><b><a href=\"/\" class=\"sc-handle\" rel=\"noopener noreferrer\" target=\"_blank\"><strong>#OUTERPLANE</strong></a> <a href=\"/\" class=\"sc-handle\" rel=\"noopener noreferrer\" target=\"_blank\"><strong>#Veronica</strong></a></b><br><br></p></div>",
      "images": [
        "/compendium/2023-05-19-veronica/49d0e668d7f34111bd8440bee7a87eb1_002.webp"
      ],
      "uid": "compendium:2023-05-19-veronica"
    },
    {
      "id": "2023-05-12-valentine",
      "title": "Valentine",
      "date": "05-12-2023",
      "date_iso": "2023-05-12T00:00:00.000Z",
      "author": null,
      "sourceUrl": null,
      "coverImage": null,
      "html": "<!----> <div><img src=\"/compendium/2023-05-12-valentine/e02f5d9c7ddd464f9a6e1f0129ed2a0f_002.webp\" class=\"fr-fic\"><p>Mafia boss who enjoys thrilling matches, Valentine</p><p><b><a href=\"/\" class=\"sc-handle\" rel=\"noopener noreferrer\" target=\"_blank\"><strong>#OUTERPLANE</strong></a> <a href=\"/\" class=\"sc-handle\" rel=\"noopener noreferrer\" target=\"_blank\"><strong>#Valentine</strong></a></b></p></div>",
      "images": [
        "/compendium/2023-05-12-valentine/e02f5d9c7ddd464f9a6e1f0129ed2a0f_002.webp"
      ],
      "uid": "compendium:2023-05-12-valentine"
    },
    {
      "id": "2023-05-05-stella",
      "title": "Stella",
      "date": "05-05-2023",
      "date_iso": "2023-05-05T00:00:00.000Z",
      "author": null,
      "sourceUrl": null,
      "coverImage": null,
      "html": "<!----> <div><img src=\"/compendium/2023-05-05-stella/da968555b127401fa4fdaeb4eaa6e39d_002.webp\" class=\"fr-fic\"><p><br>Stella, the princess who rules White Falcon<br><a href=\"/\" class=\"sc-handle\" rel=\"noopener noreferrer\" target=\"_blank\"><strong>#OUTERPLANE</strong></a> <a href=\"/\" class=\"sc-handle\" rel=\"noopener noreferrer\" target=\"_blank\"><strong>#Stella</strong></a></p></div>",
      "images": [
        "/compendium/2023-05-05-stella/da968555b127401fa4fdaeb4eaa6e39d_002.webp"
      ],
      "uid": "compendium:2023-05-05-stella"
    },
    {
      "id": "2023-04-28-snow",
      "title": "Snow",
      "date": "04-28-2023",
      "date_iso": "2023-04-28T00:00:00.000Z",
      "author": null,
      "sourceUrl": null,
      "coverImage": null,
      "html": "<!----> <div><img src=\"/compendium/2023-04-28-snow/569ef7f3804742a48f6a27af384c73ab_002.webp\" class=\"fr-fic\"><p>Introducing Elf Snow, the next chieftain of the Frost Elves.<br><br><a href=\"/\" class=\"sc-handle\" rel=\"noopener noreferrer\" target=\"_blank\"><strong>#OUTERPLANE</strong></a> <a href=\"/\" class=\"sc-handle\" rel=\"noopener noreferrer\" target=\"_blank\"><strong>#Snow</strong></a></p></div>",
      "images": [
        "/compendium/2023-04-28-snow/569ef7f3804742a48f6a27af384c73ab_002.webp"
      ],
      "uid": "compendium:2023-04-28-snow"
    },
    {
      "id": "2023-04-21-lisha",
      "title": "Lisha",
      "date": "04-21-2023",
      "date_iso": "2023-04-21T00:00:00.000Z",
      "author": null,
      "sourceUrl": null,
      "coverImage": null,
      "html": "<!----> <div><img src=\"/compendium/2023-04-21-lisha/4160b46a0d8c4688b9d2011e9a3060fd_002.webp\" class=\"fr-fic\"><p><br>Lisha, the genius mage girl who can see the color of mana<br><a href=\"/\" class=\"sc-handle\" rel=\"noopener noreferrer\" target=\"_blank\"><strong>#OUTERPLANE</strong></a> <a href=\"/\" class=\"sc-handle\" rel=\"noopener noreferrer\" target=\"_blank\"><strong>#Lisha</strong></a></p></div>",
      "images": [
        "/compendium/2023-04-21-lisha/4160b46a0d8c4688b9d2011e9a3060fd_002.webp"
      ],
      "uid": "compendium:2023-04-21-lisha"
    },
    {
      "id": "2023-04-14-eva",
      "title": "Eva",
      "date": "04-14-2023",
      "date_iso": "2023-04-14T00:00:00.000Z",
      "author": null,
      "sourceUrl": null,
      "coverImage": null,
      "html": "<!----> <div><img src=\"/compendium/2023-04-14-eva/a0c64fd5c42e4fc3a3bb2bee5b77447b.webp\" class=\"fr-fic\"><p><br>Discover Automaton Eva, the curious girl seeking to understand emotions.<br><a href=\"/\" class=\"sc-handle\" rel=\"noopener noreferrer\" target=\"_blank\"><strong>#OUTERPLANE</strong></a> <a href=\"/\" class=\"sc-handle\" rel=\"noopener noreferrer\" target=\"_blank\"><strong>#Eva</strong></a></p></div>",
      "images": [
        "/compendium/2023-04-14-eva/a0c64fd5c42e4fc3a3bb2bee5b77447b.webp"
      ],
      "uid": "compendium:2023-04-14-eva"
    },
    {
      "id": "2023-04-07-k",
      "title": "K",
      "date": "04-07-2023",
      "date_iso": "2023-04-07T00:00:00.000Z",
      "author": null,
      "sourceUrl": null,
      "coverImage": null,
      "html": "<!----> <div><img src=\"/compendium/2023-04-07-k/6c2199ce8b51492bb4e9d9d965ee34fb_002.webp\" class=\"fr-fic\"><p>Meet K, the Earthling summoned to Mirsha by Princess Stella.<br><br><a href=\"/\" class=\"sc-handle\" rel=\"noopener noreferrer\" target=\"_blank\"><strong>#OUTERPLANE</strong></a> <a href=\"/\" class=\"sc-handle\" rel=\"noopener noreferrer\" target=\"_blank\"><strong>#K</strong></a></p></div>",
      "images": [
        "/compendium/2023-04-07-k/6c2199ce8b51492bb4e9d9d965ee34fb_002.webp"
      ],
      "uid": "compendium:2023-04-07-k"
    }
  ]
}